{
  "@context": "https://epistack.dev/ns/cairn.v0.jsonld",
  "@type": "epi:Source",
  "id": "tt:H3D1t-C030hJyI6dZjNd_BhBBGt-XiXoo6Q02g9xqjA",
  "assertion": {
    "title": "Effects of extended-release metoprolol succinate in patients undergoing non-cardiac surgery (POISE trial): a randomised controlled trial",
    "authors": "Devereaux PJ, Yang H, Yusuf S, ... (POISE Study Group)",
    "venue": "Lancet",
    "year": 2008,
    "volume": "371",
    "issue": "9627",
    "pages": "1839-1847",
    "doi": "10.1016/S0140-6736(08)60601-7",
    "pmid": "18479744",
    "excerpt_kind": "abstract (version of record)",
    "excerpt": "BACKGROUND: Trials of beta blockers in patients undergoing non-cardiac surgery have reported conflicting results. This randomised controlled trial, done in 190 hospitals in 23 countries, was designed to investigate the effects of perioperative beta blockers.\nMETHODS: We randomly assigned 8351 patients with, or at risk of, atherosclerotic disease who were undergoing non-cardiac surgery to receive extended-release metoprolol succinate (n=4174) or placebo (n=4177), by a computerised randomisation phone service. Study treatment was started 2-4 h before surgery and continued for 30 days. Patients, health-care providers, data collectors, and outcome adjudicators were masked to treatment allocation. The primary endpoint was a composite of cardiovascular death, non-fatal myocardial infarction, and non-fatal cardiac arrest. Analyses were by intention to treat. This trial is registered with ClinicalTrials.gov, number NCT00182039.\nFINDINGS: All 8351 patients were included in analyses; 8331 (99.8%) patients completed the 30-day follow-up. Fewer patients in the metoprolol group than in the placebo group reached the primary endpoint (244 [5.8%] patients in the metoprolol group vs 290 [6.9%] in the placebo group; hazard ratio 0.84, 95% CI 0.70-0.99; p=0.0399). Fewer patients in the metoprolol group than in the placebo group had a myocardial infarction (176 [4.2%] vs 239 [5.7%] patients; 0.73, 0.60-0.89; p=0.0017). However, there were more deaths in the metoprolol group than in the placebo group (129 [3.1%] vs 97 [2.3%] patients; 1.33, 1.03-1.74; p=0.0317). More patients in the metoprolol group than in the placebo group had a stroke (41 [1.0%] vs 19 [0.5%] patients; 2.17, 1.26-3.74; p=0.0053).\nINTERPRETATION: Our results highlight the risk in assuming a perioperative beta-blocker regimen has benefit without substantial harm, and the importance and need for large randomised trials in the perioperative setting. Patients are unlikely to accept the risks associated with perioperative extended-release metoprolol.",
    "excerpt_sha256": "47b8b5836b57355623771bf7f0b02bc72bb46592af1683072790bcc2a1e62d1a",
    "retrieval": {
      "fetched_at": "2026-07-15",
      "method": "NCBI E-utilities efetch (PMID 18479744); AbstractText via itertext()",
      "sources": [
        "https://eutils.ncbi.nlm.nih.gov/entrez/eutils/efetch.fcgi?db=pubmed&id=18479744&rettype=abstract&retmode=xml"
      ]
    },
    "verification": "L1",
    "role": "the genuinely INDEPENDENT line (the combinable contrast) — a large RCT disjoint from the DECREASE program; it points the OTHER way (metoprolol increased mortality)"
  },
  "provenance": {
    "derivedFrom": [
      "tt:aBK_fREgfTJl0sqn2Qb3LPCi8oCn82XlVTWlq5lVwzI"
    ],
    "mintedBy": "keystone:epistack-corpus",
    "method": "ingest",
    "at": "2026-06-28T00:00:00Z"
  },
  "pubinfo": {
    "sig": {
      "alg": "ed25519",
      "key": "5b9437adeaffbe8f41b13d96ed49d2f51cd6c266cd8ecc284b0552ec4912b8dd",
      "value": "520005867a7c2e4b4eb2f58866a6901d871876bfd5371fd5eb11bfed4930698e7f55e0e7f781a53b77300ff1223f0f871842c21feb247525597457620f94d106",
      "by": "keystone:epistack-corpus"
    }
  }
}
